authors	journal	year	publisher	title	query
AJ Borchert, AN Wilson, WE Michener, J Roback… 	Green …	 2023 	pubs.rsc.org	Biological conversion of cyclic ketones from catalytic fast pyrolysis with Pseudomonas putida KT2440	NC_002947
S Klaes, S Madan, D Deobald, M Cooper… 	International Journal of …	 2023 	mdpi.com	GroEL-Proteotyping of bacterial communities using tandem mass spectrometry	NC_002947
R Avendaño, S Muñoz‐Montero… 	Microbial …	 2023 	Wiley Online Library	Production of selenium nanoparticles occurs through an interconnected pathway of sulphur metabolism and oxidative stress response in Pseudomonas putida …	NC_002947
J Han, M Zhang, Y Wang, Z Liu, X Shi, Y He… 	Applied Biochemistry …	 2024 	Springer	Cold Plasma Treatment Facilitated the Conversion of Lignin-Derived Aldehyde for Pseudomonas putida	AE015451
R Jamontas, A Laurynėnas, D Povilaitytė… 	Nucleic Acids …	 2024 	academic.oup.com	RudS: bacterial desulfidase responsible for tRNA 4-thiouridine de-modification	AE015451
C Suzuki-Minakuchi, N Yamamoto… 	Applied and …	 2024 	Am Soc Microbiol	Transcriptional heterogeneity of catabolic genes on the plasmid pCAR1 causes host-specific carbazole degradation	AE015451
MA Molina-Henares, MI Ramos-González… 	…	 2024 	microbiologyresearch.org	Gene expression reprogramming of Pseudomonas alloputida in response to arginine through the transcriptional regulator ArgR	AE015451
YS Ackermann, J de Witt, MP Mezzina, C Schroth… 	Microbial Cell …	 2024 	Springer	Bio-upcycling of even and uneven medium-chain-length diols and dicarboxylates to polyhydroxyalkanoates using engineered Pseudomonas putida	AE015451
L Ampntelnour, EG Poulaki, V Dimitrakas… 	Journal of Applied …	 2024 	academic.oup.com	Enhancing Botrytis disease management in tomato plants: insights from a Pseudomonas putida strain with biocontrol activity	AE015451
Z Udaondo, JL Ramos, K Abram 	FEMS Microbiology Reviews	 2024 	academic.oup.com	Unraveling the genomic diversity of the Pseudomonas putida group: exploring taxonomy, core pangenome, and antibiotic resistance mechanisms	AE015451
PH Santos-Oliveira, NFG Machado, RD de Oliveira… 	Bioresource …	 2024 	Elsevier	Oxidation of propionate in Pseudomonas sp. LFM046: Relevance to the synthesis of polyhydroxyalkanoates containing odd-chain length monomers and 2 …	AE015451
SG Zavala-Meneses, A Firrincieli, P Chalova, P Pajer… 	Microorganisms	 2024 	mdpi.com	Proteogenomic Characterization of Pseudomonas veronii SM-20 Growing on Phenanthrene as Only Carbon and Energy Source	AE015451
NL Bitzenhofer, C Höfel, S Thies… 	Microbial …	 2024 	Wiley Online Library	Exploring engineered vesiculation by Pseudomonas putida KT2440 for natural product biosynthesis	AE015451
R Tiwari, C Sathesh-Prabu, Y Kim, SK Lee 	Bioresource Technology	 2024 	Elsevier	Simultaneous utilization of glucose and xylose by metabolically engineered Pseudomonas putida for the production of 3-hydroxypropionic acid	NC_002947
FF Veras, P Stincone, JE Welke, AC Ritter… 	Brazilian Journal of …	 2024 	Springer	Genome analysis of Pseudomonas strain 4B with broad antagonistic activity against toxigenic fungi	NC_002947
L Nie, Y Xiao, T Zhou, H Feng, M He… 	Nucleic Acids …	 2024 	academic.oup.com	Cyclic di-GMP inhibits nitrate assimilation by impairing the antitermination function of NasT in Pseudomonas putida	NC_002947
Z Al-Tameemi, A Rodríguez-Verdugo 	msystems	 2024 	journals.asm.org	Microbial diversification is maintained in an experimentally evolved synthetic community	NC_002947
I Jones, D Vermillion, C Tracy, R Denton… 	Applied and …	 2024 	journals.asm.org	Isolation, characterization, and genetic manipulation of cold-tolerant, manganese-oxidizing Pseudomonas sp. strains	NC_002947
Y Zhou, X Zhang, W Yu, Y Fu, L Ni, J Yu, X Wang… 	International Journal of …	 2024 	Elsevier	Enhancing Pseudomonas cell growth for the production of medium-chain-length polyhydroxyalkanoates from Antarctic krill shell waste	NC_002947
J Ruan, J Wang, C Yang, W Liu, F He… 	… and Environmental Safety	 2024 	Elsevier	Biodegradation enhancement of high concentrations formaldehyde waste gas and verification of the metabolic mechanism	NC_002947
W Chen, R Ma, Y Feng, Y Xiao… 	Microbial …	 2024 	Wiley Online Library	GnuR Represses the Expression of Glucose and Gluconate Catabolism in Pseudomonas putida KT2440	NC_002947
S Köbbing, T Lechtenberg, B Wynands… 	ACS Synthetic …	 2024 	ACS Publications	Reliable Genomic Integration Sites in Pseudomonas putida Identified by Two-Dimensional Transcriptome Analysis	NC_002947
H Meng, S Köbbing, LM Blank 	Microbial Biotechnology	 2024 	Wiley Online Library	Establishing a straightforward I‐SceI‐mediated recombination one‐plasmid system for efficient genome editing in P. putida KT2440	NC_002947
P Urbanowicz, R Izdebski, M Biedrzycka… 	Journal of …	 2024 	academic.oup.com	VIM-type metallo-β-lactamase (MBL)-encoding genomic islands in Pseudomonas spp. in Poland: predominance of clc-like integrative and conjugative elements …	NC_002947
S Han, D Kim, Y Kim, SH Yoon 	BMC genomics	 2024 	Springer	Genome-scale metabolic network model and phenome of solvent-tolerant Pseudomonas putida S12	NC_002947
M Zhao, X Wu, Y Tao, Y Xiao 	Green Chemistry	 2024 	pubs.rsc.org	Full use of lignocellulosic biomass for efficient synthesis of l-tyrosine and its analogues by engineering microbial consortia	NC_002947
A Yoshida, I Kurnia, Y Higuchi, Y Osaka… 	Journal of Bioscience …	 2024 	Elsevier	Direct catalytic oxidation of rice husk lignin with hydroxide nanorod-modified copper foam and muconate production by engineered Pseudomonas sp. NGC7	NC_002947
R Moreno, L Yuste, G Morales… 	Microbial biotechnology	 2024 	Wiley Online Library	Inactivation of Pseudomonas putida KT2440 pyruvate dehydrogenase relieves catabolite repression and improves the usefulness of this strain for degrading aromatic …	NC_002947
JM Hernández-Sancho, A Boudigou… 	Nature …	 2024 	nature.com	A versatile microbial platform as a tunable whole-cell chemical sensor	NC_002947
